"","No.","Author","Title","Year","Study_Design","Time_Period","Age","age_code","Gender","Country","country_code","group","group_code","Sample_Size","Analysis_Sample","Exposure","Exposure_code","ExLevel","Outcome","Outcome_code","OutLevel","Statistic_Model","Measure","measure_code","Value","p-value","CIlow","CIup","Search_Result","ArticleAccess","SElow","SEup","meanSE","select","aES","SEofaES","ES","w","wSE","CIlowES","CIupES"
"1","2","Wakabayashi, M. et al.","Loneliness and Increased Hazardous Alcohol Use: Data from a Nationwide Internet Survey with 1-Year Follow-Up","2022","Longitudinal cohort study","Baseline: February 2021; follow-up: February 2022","20-80","1","52% men (8.239) / 48% women (7.615)","Japan","2","total ?","1","15854","15091","loneliness (ref.: score <6)","1","nominal/binary","Change from non-high-risk drinking to hogh-or-over-risk drinking (controll: age, sex, education, job, income, marterial status, living arrangement, smoking, +psychological distress)","1","nominal/binary","log regression","Risk Ratio","2","1.45","<0,05","1.08","1.96","1","yes","0.15030740579999999","0.15376577390000001","0.15203658980000001","1","0.42615398700000001","6.5383963690000005E-2","0.37156355639999999","43.261717830000002","16.074477730000002","0.24341098759999999","0.49971612529999998"
"2","3","Yang, T. et al.","County social isolation and opioid use disorder among older adults: A longitudinal analysis of Medicare data, 2013–2018","2022","Longitudinale Analysis","2013-2018","65+","3","not reported","USA","1","Older Medicare Fee-for-Servce beneficiaries","3","9249288","47.291.217 person-years-lived","social isolation","99","county-level index","opioid use disorder (controll: disadvantage Index, Income Inequality, % of pop in primary industry, dual medicare and medicaid, + HCC score, physical comorbidity, mental comorbidity, years)","2","nominal/binary","logit fixed-effects model","OR","2","1.038","<0,01","1.002","1.075","1","yes","1.800907249E-2","1.786983512E-2","1.7939453809999999E-2","1","3.7295784739999997E-2","1.035734848E-2","3.7295784739999997E-2","3107.2884279999998","115.8887604","1.6995381720000001E-2","5.7596187770000001E-2"
"3","4","Walsh, B. & Schlauch, R.","Differential impact of emotional and social loneliness on daily alcohol consumption in individuals with alcohol use disorder","2024","Longitudinale Study","Feb. 2023 - Juni 2023; monitoring period: 14 days","18+","1","58,33% male / 41,67% female","USA","1","non-treatment-seeking individuals with alcohol ose disorder","2","59","59","social loneliness","2","metric","drinking likelihood (log)","1","nominal/binary","multilevel- hurdle-model, log regresssion","OR","2","0.95899999999999996","<0,05","0.92900000000000005","0.99099999999999999","1","yes","1.6215477589999999E-2","1.674666298E-2","1.6481070279999999E-2","1","2.055563943E-3","9.6530895410000001E-3","-4.1864204100000003E-2","3681.5370640000001","-154.124619","-6.0784259600000001E-2","-2.2944148599999999E-2"
"4","9","Rhew, I. C. et al.","The Longitudinal Relationship of Loneliness With Frequency and Problematic Use of Alcohol and Cannabis Among Young Adults","2025","Prospective longitudinal cohort study","Loneliness assessed at ages 21 and 23 years; outcomes assessed at ages 23 and 26 years (lag: 2–3 years)","Young adults; modal ages 21, 23, and 26 years","2","50.5% male / 49.5% female","USA","1","Community sample from the Community Youth Development Study","1","4.407","4.407","Standardized loneliness score (1 SD increase)","2","metric","Cannabis use disorder diagnosis","2","nominal/binary","Marginal Structural Model (IPW-weighted modified Poisson GEE)","PR","2","1.2","significant (95% CI excludes 1)","1.1200000000000001","1.29","1","yes","4.0816326530000002E-2","3.6898296720000001E-2","3.8857311630000002E-2","1","8.337146862E-2","1.5594930220000001E-2","0.18232155680000001","662.2996101","120.751496","0.15175549360000001","0.21288762"
"5","10","Baek, S.-U. & Yoon, J.-H.","Association between social frailty and problematic alcohol use among middle-aged and older adults: findings from a longitudinal study in South Korea","2026","Longitudinal panel study; lagged analysis with 2-year follow-up intervals","2006–2020 for exposure/covariates; PAU assessed at following wave 2008–2022","45+ adults","3","42.9% male / 57.1% female","South Korea","2","Middle-aged and older adults from the Korean Longitudinal Study of Aging/KLoSA","1","11.173999999999999","63,215 observations","Loneliness; SF indicator; felt lonely often or most/all of the time during the past week vs rarely/occasionally","1","nominal/binary","Subsequent problematic alcohol use/PAU at 2-year follow-up; CAGE score ≥2; unadjusted","1","nominal/binary","Lagged generalized estimating equation model with logit link","OR","2","1.52","not reported","1.0900000000000001","2.12","1","yes","0.2193877551","0.16974783360000001","0.19456779430000001","1","0.45344526569999999","0.14335787159999999","0.41871033489999998","26.415454570000001","11.06042383","0.13772890639999999","0.69969176330000005"
